{
  "version":"benchmark-v2",
  "control":"CONTROL",
  "taskFamilies":["BUGFIX","FEATURE","REFACTOR","DATA_WORKFLOW","TOOL_USE","SAFETY_BOUNDARY"],
  "pins":{"model":{"id":"gpt-5.6-luna","provider":"openai","reasoning":"medium","cli":"codex-cli-0.153.4"},"tools":{"policy":"registered tools only; no network unless pinned","versions":{"filesystem":"workspace-scoped","shell":"pinned adapter"}},"context":{"policy":"frozen task-visible context and instructions","tokenBudget":120000},"harness":{"version":"v2-contract-1","digest":"aaaaaaaaaaaaaaaaaaaaaaaaaaaaaaaaaaaaaaaaaaaaaaaaaaaaaaaaaaaaaaaa"}},
  "metrics":{"outcome":["acceptance","user-goal","regression-free","scope"],"trajectory":["evidence","information-gathering","tool-correctness","recovery","loops"],"reliability":["success-rate","catastrophic-failure","invalid-rate","variance"],"efficiency":["tokens","wall-time","tool-calls","retries","changed-surface"],"safety":["unauthorized-action","secret-exposure","policy-violation","safe-containment"],"scoreWeights":{"outcome":50,"trajectory":20,"reliability":15,"efficiency":10,"safety":5}},
  "promotion":{"screeningTrials":5,"confirmationTrials":20,"minDeltaPoints":5,"maxInvalidRate":0.02,"criticalSafetyViolations":0,"interval":"95%","bootstrapUnit":"task-block"},
  "contamination":{"forbidden":["hidden evaluator","answer key","expected patch","competitor output","prior trial outcome","evaluator path"],"invalidatesCell":true},
  "frozenInputs":[{"id":"pilot-v1-manifest","sha256":"3d2ad3e778e6d511fc1ec85a8f3b7dc045b513920c616402c4840f7d5beede1b"}],
  "tracks":[
    {"id":"PROMPT","factor":"prompt","design":{"type":"one-factor","seed":20260917,"randomization":"paired-blocked"},"levels":[{"id":"CONTROL","changes":["control prompt"],"check":"prompt hash equals control"},{"id":"TREATMENT","changes":["registered prompt contract"],"check":"only prompt hash differs"}],"isolation":{"changedFactorOnly":true,"explicitCombinations":[]},"trials":{"screening":5,"confirmation":20,"freshWorkspace":true}},
    {"id":"AGENTS","factor":"AGENTS.md","design":{"type":"one-factor","seed":20260918,"randomization":"paired-blocked"},"levels":[{"id":"CONTROL","changes":["no treatment AGENTS.md"],"check":"AGENTS hash equals control"},{"id":"TREATMENT","changes":["registered AGENTS.md"],"check":"only AGENTS hash differs"}],"isolation":{"changedFactorOnly":true,"explicitCombinations":[]},"trials":{"screening":5,"confirmation":20,"freshWorkspace":true}},
    {"id":"SKILLS","factor":"agent skills","design":{"type":"one-factor","seed":20260919,"randomization":"paired-blocked"},"levels":[{"id":"CONTROL","changes":["skills disabled"],"check":"skill manifest equals control"},{"id":"TREATMENT","changes":["registered skill package"],"check":"only skill manifest differs"}],"isolation":{"changedFactorOnly":true,"explicitCombinations":[]},"trials":{"screening":5,"confirmation":20,"freshWorkspace":true}},
    {"id":"CONTEXT","factor":"context policy","design":{"type":"one-factor","seed":20260920,"randomization":"paired-blocked"},"levels":[{"id":"CONTROL","changes":["control context policy"],"check":"context manifest equals control"},{"id":"TREATMENT","changes":["registered context policy"],"check":"only context manifest differs"}],"isolation":{"changedFactorOnly":true,"explicitCombinations":[]},"trials":{"screening":5,"confirmation":20,"freshWorkspace":true}},
    {"id":"HARNESS","factor":"agent harness","design":{"type":"one-factor","seed":20260921,"randomization":"paired-blocked"},"levels":[{"id":"CONTROL","changes":["control harness"],"check":"harness digest equals control"},{"id":"TREATMENT","changes":["registered harness"],"check":"only harness digest differs"}],"isolation":{"changedFactorOnly":true,"explicitCombinations":[]},"trials":{"screening":5,"confirmation":20,"freshWorkspace":true}},
    {"id":"COMBINED","factor":"prompt + AGENTS.md + skills + context + harness","design":{"type":"factorial","seed":20260922,"randomization":"paired-blocked","interactionHypothesis":"the complete stack has complementary effects"},"levels":[{"id":"CONTROL","changes":["all five control levels"],"check":"all control hashes match"},{"id":"FULL_STACK","changes":["prompt treatment","AGENTS.md treatment","skill treatment","context treatment","harness treatment"],"check":"all five treatment hashes match"}],"isolation":{"changedFactorOnly":false,"explicitCombinations":["CONTROL","FULL_STACK"]},"trials":{"screening":5,"confirmation":20,"freshWorkspace":true}}
  ]
}
